First 10 rows:
   No.      Time         Source    Destination Protocol  Length  Source Port  Destination Port                                                                  Info
0    1  0.000000  60.190.223.75  147.32.84.165      TCP    1514       2012.0            1048.0                    2012  >  1048 [ACK] Seq=1 Ack=1 Win=65434 Len=1460
1    2  0.000168  60.190.223.75  147.32.84.165      TCP    1514       2012.0            1048.0                 2012  >  1048 [ACK] Seq=1461 Ack=1 Win=65434 Len=1460
2    3  0.000377  147.32.84.165  60.190.223.75      TCP      60       1048.0            2012.0                    1048  >  2012 [ACK] Seq=1 Ack=2921 Win=64240 Len=0
3    4  0.000384  147.32.84.165  60.190.223.75      TCP      60       1048.0            2012.0  [TCP Dup ACK 3#1] 1048  >  2012 [ACK] Seq=1 Ack=2921 Win=64240 Len=0
4    5  0.000629  60.190.223.75  147.32.84.165      TCP    1514       2012.0            1048.0                 2012  >  1048 [ACK] Seq=2921 Ack=1 Win=65434 Len=1460
5    6  0.153526  147.32.84.165  60.190.223.75      TCP      60       1048.0            2012.0                    1048  >  2012 [ACK] Seq=1 Ack=4381 Win=64240 Len=0
6    7  0.153540  147.32.84.165  60.190.223.75      TCP      60       1048.0            2012.0  [TCP Dup ACK 6#1] 1048  >  2012 [ACK] Seq=1 Ack=4381 Win=64240 Len=0
7    8  0.165282  60.190.223.75  147.32.84.165      TCP    1514       2012.0            1048.0                 2012  >  1048 [ACK] Seq=4381 Ack=1 Win=65434 Len=1460
8    9  0.353897  147.32.84.165  60.190.223.75      TCP      60       1048.0            2012.0                    1048  >  2012 [ACK] Seq=1 Ack=5841 Win=64240 Len=0
9   10  0.353907  147.32.84.165  60.190.223.75      TCP      60       1048.0            2012.0  [TCP Dup ACK 9#1] 1048  >  2012 [ACK] Seq=1 Ack=5841 Win=64240 Len=0

Columns:
No., Time, Source, Destination, Protocol, Length, Source Port, Destination Port, Info